model_comparison.csv

,Accuracy,AUC,Precision,Recall,F1 Score,MCC
Logistic Regression,0.8558268079226163,0.9078006025463776,0.740627390971691,0.6173469387755102,0.6733913043478261,0.5858342263511627
Decision Tree,0.8142177184093352,0.7537457311033614,0.6091463414634146,0.6371173469387755,0.6228179551122195,0.49987887955601235
KNN,0.8366344234607708,0.8679168558222075,0.6774647887323944,0.6135204081632653,0.643908969210174,0.5393626380610169
Naive Bayes,0.5381544603101489,0.749485733373228,0.33739837398373984,0.9528061224489796,0.4983322214809873,0.3294378587548402
Random Forest,0.8558268079226163,0.9064863369513632,0.7341772151898734,0.6288265306122449,0.6774304362761937,0.5882221541166678

README.md

### Logistic Regression

Logistic Regression performed very well, achieving 85.58% accuracy and the highest AUC of 90.78%. It also achieved the highest precision among the five models. Its recall was slightly lower than Decision Tree and Random Forest, but its overall performance was strong and balanced.

### KNN

KNN achieved 83.66% accuracy and 86.79% AUC. Its performance was better than Decision Tree and Naive Bayes on most metrics, but lower than Logistic Regression and Random Forest. Its F1 score was 64.39% and MCC was 0.5394.

### Naive Bayes

Naive Bayes achieved a very high recall of 95.28%, meaning that it identified most of the actual `>50K` cases. However, its precision was only 33.74%, resulting in many false positives. Consequently, it achieved the lowest accuracy, F1 score and MCC among the evaluated models.